<?xml version="1.0" encoding="ISO-8859-1"?>
<Document xmlns:xsi="http://www.w3.org/2001/XMLSchema-instance" xsi:noNamespaceSchemaLocation="../files/prod/javapos/armani/document.xsd">
  <Customer>
    <Type>Type</Type>
    <Code>Code</Code>
    <Descr>Descr</Descr>
    <Title>Title</Title>
    <Surname>Surname</Surname>
    <Name>Name</Name>
    <Address>Address</Address>
    <City>City</City>
    <Country>Country</Country>
    <CountryCode>CountryCode</CountryCode>
    <Zip>Zip</Zip>
    <State>State</State>
    <StateCode>StateCode</StateCode>
    <IdType>IdType</IdType>
    <IdNumber>IdNumber</IdNumber>
  </Customer>
  <Owner>
    <Type>Type</Type>
    <Code>Code</Code>
    <Descr>Descr</Descr>
    <Title>Title</Title>
    <Surname>Surname</Surname>
    <Name>Name</Name>
    <Address>Address</Address>
    <City>City</City>
    <Country>Country</Country>
    <CountryCode>CountryCode</CountryCode>
    <Zip>Zip</Zip>
    <State>State</State>
    <StateCode>StateCode</StateCode>
    <IdType>IdType</IdType>
    <IdNumber>IdNumber</IdNumber>
  </Owner>
  <refCustomer>
    <Type>Type</Type>
    <Code>Code</Code>
    <Descr>Descr</Descr>
    <Title>Title</Title>
    <Surname>Surname</Surname>
    <Name>Name</Name>
    <Address>Address</Address>
    <City>City</City>
    <Country>Country</Country>
    <CountryCode>CountryCode</CountryCode>
    <Zip>Zip</Zip>
    <State>State</State>
    <StateCode>StateCode</StateCode>
    <IdType>IdType</IdType>
    <IdNumber>IdNumber</IdNumber>
  </refCustomer>
  <refDocument>
    <DocType>SCF</DocType>
    <DocNumber>DocNumber</DocNumber>
    <DocDate>2005-04-20</DocDate>
    <DocName>DocName</DocName>
    <OwnerCode>OwnerCode</OwnerCode>
    <DocNote>DocNote</DocNote>
  </refDocument>
  <Destination>
    <Type>Type</Type>
    <Code>Code</Code>
    <Descr>Descr</Descr>
    <Title>Title</Title>
    <Surname>Surname</Surname>
    <Name>Name</Name>
    <Address>Address</Address>
    <City>City</City>
    <Country>Country</Country>
    <CountryCode>CountryCode</CountryCode>
    <Zip>Zip</Zip>
    <State>State</State>
    <StateCode>StateCode</StateCode>
    <IdType>IdType</IdType>
    <IdNumber>IdNumber</IdNumber>
  </Destination>
  <Carrier>
    <Type>Type</Type>
    <Code>Code</Code>
    <Descr>Descr</Descr>
    <Title>Title</Title>
    <Surname>Surname</Surname>
    <Name>Name</Name>
    <Address>Address</Address>
    <City>City</City>
    <Country>Country</Country>
    <CountryCode>CountryCode</CountryCode>
    <Zip>Zip</Zip>
    <State>State</State>
    <StateCode>StateCode</StateCode>
    <IdType>IdType</IdType>
    <IdNumber>IdNumber</IdNumber>
  </Carrier>
  <key>
    <DocType>SCF</DocType>
    <DocNumber>DocNumber</DocNumber>
    <DocDate>2005-04-20</DocDate>
    <DocName>DocName</DocName>
    <OwnerCode>OwnerCode</OwnerCode>
    <DocNote>DocNote</DocNote>
  </key>
  <Expedition>
    <ExpeditionCode>ExpeditionCode</ExpeditionCode>
    <ExpeditionDescr>ExpeditionDescr</ExpeditionDescr>
    <ExpeditionNo>ExpeditionNo</ExpeditionNo>
    <ExpeditionDate>2005-04-20</ExpeditionDate>
  </Expedition>
  <Totals>
    <TotalQty>TotalQty</TotalQty>
    <Currency>Currency</Currency>
    <TotalPrice>0.0</TotalPrice>
    <TotalDiscount>0.0</TotalDiscount>
    <TotalFinalPrice>0.0</TotalFinalPrice>
    <TotalVat>0.0</TotalVat>
    <TotalNet>0.0</TotalNet>
    <TotalCost>0.0</TotalCost>
    <TotalRefund>0.0</TotalRefund>
    <RefDocundType>RefDocundType</RefDocundType>
    <DocPackType>DocPackType</DocPackType>
    <DocPackDesc>DocPackDesc</DocPackDesc>
    <DocPackNo>1</DocPackNo>
    <TotalWeight>0.0</TotalWeight>
  </Totals>
  <DocDescr01>DocDescr01</DocDescr01>
  <DocValue01>0.0</DocValue01>
  <DocDescr02>DocDescr02</DocDescr02>
  <DocValue02>0.0</DocValue02>
  <DocDescr03>DocDescr03</DocDescr03>
  <DocValue03>0.0</DocValue03>
  <DocDescr04>DocDescr04</DocDescr04>
  <DocValue04>0.0</DocValue04>
  <DocDescr05>DocDescr05</DocDescr05>
  <DocValue05>0.0</DocValue05>
  <Payment1>
    <RowNo>1</RowNo>
    <Code>Code</Code>
    <CodeDescr>CodeDescr</CodeDescr>
    <Currency>Currency</Currency>
    <Value>0.0</Value>
    <Date>2005-04-20</Date>
    <Note>Note</Note>
  </Payment1>
  <Payment2>
    <RowNo>1</RowNo>
    <Code>Code</Code>
    <CodeDescr>CodeDescr</CodeDescr>
    <Currency>Currency</Currency>
    <Value>0.0</Value>
    <Date>2005-04-20</Date>
    <Note>Note</Note>
  </Payment2>
  <Row1>
    <RowNo>1</RowNo>
    <Descr>Descr</Descr>
    <PackType>PackType</PackType>
    <PackDescr>PackDescr</PackDescr>
    <Qty>0.0</Qty>
    <Currency>Currency</Currency>
    <Price>0.0</Price>
    <Vat>0.0</Vat>
    <VatPerc>0.0</VatPerc>
    <VatNet>0.0</VatNet>
    <Discount01>0.0</Discount01>
    <Discount02>0.0</Discount02>
    <Discount03>0.0</Discount03>
    <Discount01Desc>Discount01Desc</Discount01Desc>
    <Discount02Desc>Discount02Desc</Discount02Desc>
    <Discount03Desc>Discount03Desc</Discount03Desc>
    <FinalPrice>0.0</FinalPrice>
    <TotalPrice>0.0</TotalPrice>
    <Cost>0.0</Cost>
    <Refund>0.0</Refund>
    <RefundType>RefundType</RefundType>
    <PackNo>0.0</PackNo>
    <Weight>0.0</Weight>
    <Desc01>Desc01</Desc01>
    <Desc02>Desc02</Desc02>
    <Desc03>Desc03</Desc03>
    <Desc04>Desc04</Desc04>
    <Desc05>Desc05</Desc05>
    <Value01>0.0</Value01>
    <Value02>0.0</Value02>
    <Value03>0.0</Value03>
    <Value04>0.0</Value04>
    <Value05>0.0</Value05>
  </Row1>
  <Row2>
    <RowNo>1</RowNo>
    <Descr>Descr</Descr>
    <PackType>PackType</PackType>
    <PackDescr>PackDescr</PackDescr>
    <Qty>0.0</Qty>
    <Currency>Currency</Currency>
    <Price>0.0</Price>
    <Vat>0.0</Vat>
    <VatPerc>0.0</VatPerc>
    <VatNet>0.0</VatNet>
    <Discount01>0.0</Discount01>
    <Discount02>0.0</Discount02>
    <Discount03>0.0</Discount03>
    <Discount01Desc>Discount01Desc</Discount01Desc>
    <Discount02Desc>Discount02Desc</Discount02Desc>
    <Discount03Desc>Discount03Desc</Discount03Desc>
    <FinalPrice>0.0</FinalPrice>
    <TotalPrice>0.0</TotalPrice>
    <Cost>0.0</Cost>
    <Refund>0.0</Refund>
    <RefundType>RefundType</RefundType>
    <PackNo>0.0</PackNo>
    <Weight>0.0</Weight>
    <Desc01>Desc01</Desc01>
    <Desc02>Desc02</Desc02>
    <Desc03>Desc03</Desc03>
    <Desc04>Desc04</Desc04>
    <Desc05>Desc05</Desc05>
    <Value01>0.0</Value01>
    <Value02>0.0</Value02>
    <Value03>0.0</Value03>
    <Value04>0.0</Value04>
    <Value05>0.0</Value05>
  </Row2>
  <Row3>
    <RowNo>1</RowNo>
    <Descr>Descr</Descr>
    <PackType>PackType</PackType>
    <PackDescr>PackDescr</PackDescr>
    <Qty>0.0</Qty>
    <Currency>Currency</Currency>
    <Price>0.0</Price>
    <Vat>0.0</Vat>
    <VatPerc>0.0</VatPerc>
    <VatNet>0.0</VatNet>
    <Discount01>0.0</Discount01>
    <Discount02>0.0</Discount02>
    <Discount03>0.0</Discount03>
    <Discount01Desc>Discount01Desc</Discount01Desc>
    <Discount02Desc>Discount02Desc</Discount02Desc>
    <Discount03Desc>Discount03Desc</Discount03Desc>
    <FinalPrice>0.0</FinalPrice>
    <TotalPrice>0.0</TotalPrice>
    <Cost>0.0</Cost>
    <Refund>0.0</Refund>
    <RefundType>RefundType</RefundType>
    <PackNo>0.0</PackNo>
    <Weight>0.0</Weight>
    <Desc01>Desc01</Desc01>
    <Desc02>Desc02</Desc02>
    <Desc03>Desc03</Desc03>
    <Desc04>Desc04</Desc04>
    <Desc05>Desc05</Desc05>
    <Value01>0.0</Value01>
    <Value02>0.0</Value02>
    <Value03>0.0</Value03>
    <Value04>0.0</Value04>
    <Value05>0.0</Value05>
  </Row3>
</Document>
