<?xml version="1.0" encoding="ISO-8859-1"?>
<Document xsi:noNamespaceSchemaLocation="Document.xsd" xmlns:xsi="http://www.w3.org/2001/XMLSchema-instance">
<Customer>
    <Type>Type</Type>
    <Code>Code</Code>
    <CodeDescr>CodeDescr</CodeDescr>
    <Title>SIG.</Title>
    <Surname>ROSSI</Surname>
    <Name>MARIO</Name>
    <Address>VIALE CARRARA CALA ARCIPRETE 11</Address>
    <City>ROMA</City>
    <Country>ITALY</Country>
    <CountryCode>ITA</CountryCode>
    <Zip>000100</Zip>
    <State></State>
    <StateCode>StateCode</StateCode>
    <IdType>PI</IdType>
    <IdNumber>123456789012345</IdNumber>
  </Customer>
  <Owner>
    <Type>Type</Type>
    <Code>Code</Code>
    <CodeDescr>emporio armani</CodeDescr>
    <Title>Title</Title>
    <Surname>Brambilla</Surname>
    <Name>Mario</Name>
    <Address>viale ceccarini 10-12</Address>
    <City>Riccione</City>
    <Country>ITALY</Country>
    <CountryCode>ITA</CountryCode>
    <Zip>10001</Zip>
    <State></State>
    <StateCode>StateCode</StateCode>
    <IdType>PI</IdType>
    <IdNumber>IdNumber</IdNumber>
  </Owner>
   <Header>
    <DocType>FAT</DocType>
    <DocNumber>1234567890123</DocNumber>
    <DocDate>2005-03-21 00:00:00</DocDate>
    <DocName>Fattura</DocName>
    <OwnerCode>OwnerCode</OwnerCode>
    <DocNote>DS52000219 SCONT.FISC.N. 16</DocNote>
    <TotalQty>70.00</TotalQty>
    <Currency>EUR</Currency>
    <TotalPrice>7.57</TotalPrice>
    <TotalDiscount>1.01</TotalDiscount>
    <TotalFinalPrice>299.92</TotalFinalPrice>
    <TotalVat>12.09</TotalVat>
    <TotalNet>27.80</TotalNet>
    <TotalRefund>0.98</TotalRefund>
    <RefundType>RefDocundType</RefundType>
    <DocPackType>DocPackType</DocPackType>
    <DocPackDesc>DocPackDesc</DocPackDesc>
    <DocPackNo>1</DocPackNo>
    <TotalWeight>3.00</TotalWeight>
  </Header>
  <Row>
    <RowNo>1</RowNo>
    <Descr>Articolo 1</Descr>
    <PackType>PackType</PackType>
    <PackDescr>PackDescr</PackDescr>
    <Qty>2.00</Qty>
    <Currency>EUR</Currency>
    <Price>3.25</Price>
    <Vat>1.04</Vat>
    <VatPerc>20</VatPerc>
    <VatNet>5.20</VatNet>
    <FinalPrice>3.25</FinalPrice>
    <TotalPrice>6.24</TotalPrice>
    <Refund>0.01</Refund>
    <RefundType>RefundType</RefundType>
  </Row>
  <Row>
    <RowNo>2</RowNo>
    <Descr>Articolo 2</Descr>
    <PackType>PackType</PackType>
    <PackDescr>PackDescr</PackDescr>
    <Qty>4.00</Qty>
    <Currency>EUR</Currency>
    <Price>4.32</Price>
    <Vat>2.88</Vat>
    <VatPerc>20</VatPerc>
    <VatNet>14.40</VatNet>
    <FinalPrice>4.32</FinalPrice>
    <TotalPrice>17.28</TotalPrice>
    <Refund>0.01</Refund>
    <RefundType>RefundType</RefundType>
  </Row>
<Row>
    <RowNo>3</RowNo>
    <Descr>Articolo 3</Descr>
    <PackType>PackType</PackType>
    <PackDescr>PackDescr</PackDescr>
    <Qty>4.00</Qty>
    <Currency>EUR</Currency>
    <Price>4.32</Price>
    <Vat>2.88</Vat>
    <VatPerc>20</VatPerc>
    <VatNet>14.40</VatNet>
    <FinalPrice>4.32</FinalPrice>
    <TotalPrice>17.28</TotalPrice>
    <Refund></Refund>
    <RefundType>RefundType</RefundType>
  </Row><Row>
    <RowNo>4</RowNo>
    <Descr>Articolo 4</Descr>
    <PackType>PackType</PackType>
    <PackDescr>PackDescr</PackDescr>
    <Qty>4.00</Qty>
    <Currency>EUR</Currency>
    <Price>4.32</Price>
    <Vat>2.88</Vat>
    <VatPerc>20</VatPerc>
    <VatNet>14.40</VatNet>
    <FinalPrice>4.32</FinalPrice>
    <TotalPrice>17.28</TotalPrice>
    <Refund></Refund>
    <RefundType>RefundType</RefundType>
  </Row><Row>
    <RowNo>5</RowNo>
    <Descr>Articolo 5</Descr>
    <PackType>PackType</PackType>
    <PackDescr>PackDescr</PackDescr>
    <Qty>4.00</Qty>
    <Currency>EUR</Currency>
    <Price>4.32</Price>
    <Vat>2.88</Vat>
    <VatPerc>20</VatPerc>
    <VatNet>14.40</VatNet>
    <FinalPrice>4.32</FinalPrice>
    <TotalPrice>17.28</TotalPrice>
    <Refund></Refund>
    <RefundType>RefundType</RefundType>
  </Row><Row>
    <RowNo>6</RowNo>
    <Descr>Articolo 6</Descr>
    <PackType>PackType</PackType>
    <PackDescr>PackDescr</PackDescr>
    <Qty>4.00</Qty>
    <Currency>EUR</Currency>
    <Price>4.32</Price>
    <Vat>2.88</Vat>
    <VatPerc>20</VatPerc>
    <VatNet>14.40</VatNet>
    <FinalPrice>4.32</FinalPrice>
    <TotalPrice>17.28</TotalPrice>
    <Refund></Refund>
    <RefundType>RefundType</RefundType>
  </Row><Row>
    <RowNo>7</RowNo>
    <Descr>Articolo 7</Descr>
    <PackType>PackType</PackType>
    <PackDescr>PackDescr</PackDescr>
    <Qty>4.00</Qty>
    <Currency>EUR</Currency>
    <Price>4.32</Price>
    <Vat>2.88</Vat>
    <VatPerc>20</VatPerc>
    <VatNet>14.40</VatNet>
    <FinalPrice>4.32</FinalPrice>
    <TotalPrice>17.28</TotalPrice>
    <Refund></Refund>
    <RefundType>RefundType</RefundType>
  </Row><Row>
    <RowNo>8</RowNo>
    <Descr>Articolo 8</Descr>
    <PackType>PackType</PackType>
    <PackDescr>PackDescr</PackDescr>
    <Qty>4.00</Qty>
    <Currency>EUR</Currency>
    <Price>4.32</Price>
    <Vat>2.88</Vat>
    <VatPerc>20</VatPerc>
    <VatNet>14.40</VatNet>
    <FinalPrice>4.32</FinalPrice>
    <TotalPrice>17.28</TotalPrice>
    <Refund></Refund>
    <RefundType>RefundType</RefundType>
  </Row><Row>
    <RowNo>9</RowNo>
    <Descr>Articolo 9</Descr>
    <PackType>PackType</PackType>
    <PackDescr>PackDescr</PackDescr>
    <Qty>4.00</Qty>
    <Currency>EUR</Currency>
    <Price>4.32</Price>
    <Vat>2.88</Vat>
    <VatPerc>20</VatPerc>
    <VatNet>14.40</VatNet>
    <FinalPrice>4.32</FinalPrice>
    <TotalPrice>17.28</TotalPrice>
    <Refund></Refund>
    <RefundType>RefundType</RefundType>
  </Row><Row>
    <RowNo>10</RowNo>
    <Descr>Articolo 10</Descr>
    <PackType>PackType</PackType>
    <PackDescr>PackDescr</PackDescr>
    <Qty>4.00</Qty>
    <Currency>EUR</Currency>
    <Price>4.32</Price>
    <Vat>2.88</Vat>
    <VatPerc>20</VatPerc>
    <VatNet>14.40</VatNet>
    <FinalPrice>4.32</FinalPrice>
    <TotalPrice>17.28</TotalPrice>
    <Refund></Refund>
    <RefundType>RefundType</RefundType>
  </Row><Row>
    <RowNo>11</RowNo>
    <Descr>Articolo 11</Descr>
    <PackType>PackType</PackType>
    <PackDescr>PackDescr</PackDescr>
    <Qty>4.00</Qty>
    <Currency>EUR</Currency>
    <Price>4.32</Price>
    <Vat>2.88</Vat>
    <VatPerc>20</VatPerc>
    <VatNet>14.40</VatNet>
    <FinalPrice>4.32</FinalPrice>
    <TotalPrice>17.28</TotalPrice>
    <Refund></Refund>
    <RefundType>RefundType</RefundType>
  </Row><Row>
    <RowNo>12</RowNo>
    <Descr>Articolo 12</Descr>
    <PackType>PackType</PackType>
    <PackDescr>PackDescr</PackDescr>
    <Qty>4.00</Qty>
    <Currency>EUR</Currency>
    <Price>4.32</Price>
    <Vat>2.88</Vat>
    <VatPerc>20</VatPerc>
    <VatNet>14.40</VatNet>
    <FinalPrice>4.32</FinalPrice>
    <TotalPrice>17.28</TotalPrice>
    <Refund></Refund>
    <RefundType>RefundType</RefundType>
  </Row><Row>
    <RowNo>13</RowNo>
    <Descr>Articolo 13</Descr>
    <PackType>PackType</PackType>
    <PackDescr>PackDescr</PackDescr>
    <Qty>4.00</Qty>
    <Currency>EUR</Currency>
    <Price>4.32</Price>
    <Vat>2.88</Vat>
    <VatPerc>20</VatPerc>
    <VatNet>14.40</VatNet>
    <FinalPrice>4.32</FinalPrice>
    <TotalPrice>17.28</TotalPrice>
    <Refund></Refund>
    <RefundType>RefundType</RefundType>
  </Row><Row>
    <RowNo>14</RowNo>
    <Descr>Articolo 14</Descr>
    <PackType>PackType</PackType>
    <PackDescr>PackDescr</PackDescr>
    <Qty>4.00</Qty>
    <Currency>EUR</Currency>
    <Price>4.32</Price>
    <Vat>2.88</Vat>
    <VatPerc>20</VatPerc>
    <VatNet>14.40</VatNet>
    <FinalPrice>4.32</FinalPrice>
    <TotalPrice>17.28</TotalPrice>
    <Refund></Refund>
    <RefundType>RefundType</RefundType>
  </Row><Row>
    <RowNo>15</RowNo>
    <Descr>Articolo 15</Descr>
    <PackType>PackType</PackType>
    <PackDescr>PackDescr</PackDescr>
    <Qty>4.00</Qty>
    <Currency>EUR</Currency>
    <Price>4.32</Price>
    <Vat>2.88</Vat>
    <VatPerc>20</VatPerc>
    <VatNet>14.40</VatNet>
    <FinalPrice>4.32</FinalPrice>
    <TotalPrice>17.28</TotalPrice>
    <Refund></Refund>
    <RefundType>RefundType</RefundType>
  </Row><Row>
    <RowNo>16</RowNo>
    <Descr>Articolo 16</Descr>
    <PackType>PackType</PackType>
    <PackDescr>PackDescr</PackDescr>
    <Qty>4.00</Qty>
    <Currency>EUR</Currency>
    <Price>4.32</Price>
    <Vat>2.88</Vat>
    <VatPerc>20</VatPerc>
    <VatNet>14.40</VatNet>
    <FinalPrice>4.32</FinalPrice>
    <TotalPrice>17.28</TotalPrice>
    <Refund></Refund>
    <RefundType>RefundType</RefundType>
  </Row><Row>
    <RowNo>17</RowNo>
    <Descr>Articolo 17</Descr>
    <PackType>PackType</PackType>
    <PackDescr>PackDescr</PackDescr>
    <Qty>4.00</Qty>
    <Currency>EUR</Currency>
    <Price>4.32</Price>
    <Vat>2.88</Vat>
    <VatPerc>20</VatPerc>
    <VatNet>14.40</VatNet>
    <FinalPrice>4.32</FinalPrice>
    <TotalPrice>17.28</TotalPrice>
    <Refund></Refund>
    <RefundType>RefundType</RefundType>
  </Row><Row>
    <RowNo>18</RowNo>
    <Descr>Articolo 18</Descr>
    <PackType>PackType</PackType>
    <PackDescr>PackDescr</PackDescr>
    <Qty>4.00</Qty>
    <Currency>EUR</Currency>
    <Price>4.32</Price>
    <Vat></Vat>
    <VatPerc>N.I.</VatPerc>
    <VatNet>14.40</VatNet>
    <FinalPrice>4.32</FinalPrice>
    <TotalPrice>14.40</TotalPrice>
    <Refund>0.01</Refund>
    <RefundType>RefundType</RefundType>
  </Row>
  </Document>
